{"accepted_edge_count": 0, "accepted_edge_precision": null, "accepted_edge_true_positives": 0, "candidate_edge_count": 3, "dataset_id": "nevergone-player-horizontal-facing", "format": "REVENGINSTR.SemanticProgramGraphEvaluation/1", "gold_artifact_sha256": "ee5cb2c3a3880d3a3da9098c47a5e589d52e0d6137c6297cfff2f8197100d5ec", "minimum_confidence": 0.95, "per_relation": {"calls": {"candidate_edge_precision": 1.0, "candidate_edges": 3, "gold_edges": 3, "recall": 1.0, "true_positives": 3, "unsupported_edges": 0}}, "provenance_complete_edge_count": 3, "provenance_completeness": 1.0, "semantic_program_graph_sha256": "b2c64e397bd1e95d5f195b10dfaa2d3254a455377fdac53db9d2c2a6c08f37e5", "split_id": "consumer-adjudicated-2026-10", "subgraphs_evaluated": 1, "unsupported_edge_count": 0, "unsupported_edge_rate": 0.0, "view": "exact-only"}
