{"accepted_edge_count": 0, "accepted_edge_precision": null, "accepted_edge_true_positives": 0, "candidate_edge_count": 15, "dataset_id": "nevergone-ccjoystick-prototype-layout-crosscheck", "format": "REVENGINSTR.SemanticProgramGraphEvaluation/1", "gold_artifact_sha256": "cba50329bac18446e9a00a9480de7892e34e268f2084bd766f6260687dadf571", "minimum_confidence": 0.95, "per_relation": {"has_field": {"candidate_edge_precision": 1.0, "candidate_edges": 15, "gold_edges": 15, "recall": 1.0, "true_positives": 15, "unsupported_edges": 0}}, "provenance_complete_edge_count": 15, "provenance_completeness": 1.0, "semantic_program_graph_sha256": "f2726e5dfcc4c7e7ba8975b213c0cc157b9bc261f94fcc2ce52b5aaa327a6bf5", "split_id": "separate-ghidra-prototype-export-2026-10", "subgraphs_evaluated": 1, "unsupported_edge_count": 0, "unsupported_edge_rate": 0.0, "view": "exploratory"}
