{"accepted_edge_count": 0, "accepted_edge_precision": null, "accepted_edge_true_positives": 0, "candidate_edge_count": 7, "dataset_id": "nfs-shift-call-path-call-audit", "format": "REVENGINSTR.SemanticProgramGraphEvaluation/1", "gold_artifact_sha256": "d11991b337369e4d5db25691550cacdd685eaf15d58f3a5b13d1be2c9380ef7e", "minimum_confidence": 0.95, "per_relation": {"calls": {"candidate_edge_precision": 1.0, "candidate_edges": 7, "gold_edges": 7, "recall": 1.0, "true_positives": 7, "unsupported_edges": 0}}, "provenance_complete_edge_count": 7, "provenance_completeness": 1.0, "semantic_program_graph_sha256": "3406b35c851696ed180227cf27dbcfa2e40bf1f2c4cde22d253c114e69713bbb", "split_id": "captured-pcode-call-audit-2026-10", "subgraphs_evaluated": 1, "unsupported_edge_count": 0, "unsupported_edge_rate": 0.0, "view": "exact-only"}
