{"accepted_edge_count": 36, "accepted_edge_precision": 1.0, "accepted_edge_true_positives": 36, "candidate_edge_count": 36, "dataset_id": "nevergone-runtime-resource-calls-20261020", "format": "REVENGINSTR.SemanticProgramGraphEvaluation/1", "gold_artifact_sha256": "aa14ad64a541c20d0015a4c742ffb02d2c939318f628a7928d7adf5cad9c72d5", "minimum_confidence": 0.95, "per_relation": {"calls": {"candidate_edge_precision": 1.0, "candidate_edges": 36, "gold_edges": 36, "recall": 1.0, "true_positives": 36, "unsupported_edges": 0}}, "provenance_complete_edge_count": 36, "provenance_completeness": 1.0, "semantic_program_graph_sha256": "021065470f8da973921b701323807b60033cb0870e2cdd2f15831665b9cffaab", "split_id": "manual-audit", "subgraphs_evaluated": 1, "unsupported_edge_count": 0, "unsupported_edge_rate": 0.0, "view": "exact-only"}
