{"accepted_edge_count": 7, "accepted_edge_precision": 1.0, "accepted_edge_true_positives": 7, "candidate_edge_count": 10, "dataset_id": "nfs-m23-direct-call-field-structure", "format": "REVENGINSTR.SemanticProgramGraphEvaluation/1", "gold_artifact_sha256": "df606c38bf980329081929d63f2f1835f8e293eb78f6bdadd344ef140888496f", "minimum_confidence": 0.95, "per_relation": {"calls": {"candidate_edge_precision": 1.0, "candidate_edges": 7, "gold_edges": 7, "recall": 1.0, "true_positives": 7, "unsupported_edges": 0}, "reads": {"candidate_edge_precision": 1.0, "candidate_edges": 2, "gold_edges": 2, "recall": 1.0, "true_positives": 2, "unsupported_edges": 0}, "writes": {"candidate_edge_precision": 1.0, "candidate_edges": 1, "gold_edges": 1, "recall": 1.0, "true_positives": 1, "unsupported_edges": 0}}, "provenance_complete_edge_count": 10, "provenance_completeness": 1.0, "semantic_program_graph_sha256": "7662c65c2db67e34f25ae92f0d7c5ec5c71e254c5b2549c5209f6974d4856c4e", "split_id": "consumer-adjudicated-2026-10", "subgraphs_evaluated": 1, "unsupported_edge_count": 0, "unsupported_edge_rate": 0.0, "view": "exploratory"}
