{"accepted_edge_count": 0, "accepted_edge_precision": null, "accepted_edge_true_positives": 0, "candidate_edge_count": 2, "dataset_id": "gt5-prologue-00032830-call-audit", "format": "REVENGINSTR.SemanticProgramGraphEvaluation/1", "gold_artifact_sha256": "493952c058d50ab3bb70ca85ac91433374ad6dfa9c77ef5ec18becf611457bfc", "minimum_confidence": 0.95, "per_relation": {"calls": {"candidate_edge_precision": 1.0, "candidate_edges": 2, "gold_edges": 2, "recall": 1.0, "true_positives": 2, "unsupported_edges": 0}}, "provenance_complete_edge_count": 2, "provenance_completeness": 1.0, "semantic_program_graph_sha256": "b625d3a6ff58e19c92a78bbd0de8eb38eb25e0a06ab8f9befc281b061a980856", "split_id": "captured-pcode-call-audit-2026-10", "subgraphs_evaluated": 1, "unsupported_edge_count": 0, "unsupported_edge_rate": 0.0, "view": "exact-only"}
